<?xml version="1.0" encoding="UTF-8"?>
<servico versao="2" xmlns="http://servicos.gov.br/cartas-servico/v2/schema/servico" xmlns:xsi="http://www.w3.org/2001/XMLSchema-instance" xsi:schemaLocation="http://servicos.gov.br/cartas-servico/v2/schema/servico ../servico.xsd">
 <nome>
  Acesso ao Sped - Sistema Público de Escrituração Digital
 </nome>
 <nomes-populares>
 </nomes-populares>
 <descricao>Instituído pelo Decreto nº 6.022, de 22 de janeiro de 2007, o Sistema Público de Escrituração Digital (Sped) faz parte do Programa de Aceleração do Crescimento do Governo Federal (PAC 2007-2010) e constitui-se em mais um avanço na informatização da relação entre o fisco e os contribuintes.

De modo geral, consiste na modernização da sistemática atual do cumprimento das obrigações acessórias, transmitidas pelos contribuintes às administrações tributárias e aos órgãos fiscalizadores, utilizando-se da certificação digital para fins de assinatura dos documentos eletrônicos, garantindo assim a validade jurídica dos mesmos apenas na sua forma digital.


 </descricao>
 <palavras-chave>
 </palavras-chave>
 <areas-de-interesse>
  <area-de-interesse>
   <id>
    economia-e-financas
   </id>
   <area>Economia e Finanças</area>
  </area-de-interesse>
 </areas-de-interesse>
 <segmentos-da-sociedade>
  <segmento-da-sociedade>
   <id>
    empresas
   </id>
   <nome>
    Empresas
   </nome>
  </segmento-da-sociedade>
 </segmentos-da-sociedade>
 <eventos-da-linha-da-vida>
  <evento-da-linha-da-vida>
   <id>
    empreendedorismo-e-negocios
   </id>
   <nome>
    Empreendedorismo e negócios
   </nome>
  </evento-da-linha-da-vida>
  <evento-da-linha-da-vida>
   <id>
    contas-e-impostos
   </id>
   <nome>
    Contas e Impostos
   </nome>
  </evento-da-linha-da-vida>
 </eventos-da-linha-da-vida>
 <legislacao-relacionada></legislacao-relacionada>
 <solicitantes></solicitantes>
 <etapas>
  <etapa>
   <titulo>
   </titulo>
   <descricao>
   </descricao>
   <documentos></documentos>
   <custos excecoes="false">
    <custo>
     <descricao>
     </descricao>
     <valor>
     </valor>
    </custo>
   </custos>
   <canais-de-prestacao>
    <canal-de-prestacao tipo="Web" preferencial="true">
     <titulo>
     </titulo>
     <referencia>
      http://www.receita.fazenda.gov.br/Sped/Download/Default.htm
     </referencia>
    </canal-de-prestacao>
    <canal-de-prestacao tipo="Agendamento" preferencial="false">
     <titulo>
     </titulo>
     <referencia>
     </referencia>
    </canal-de-prestacao>
   </canais-de-prestacao>
  </etapa>
 </etapas>
 <orgao>
  <id>
   secretaria-da-receita-federal-do-brasil-rfb
  </id>
  <nome>
   Secretaria da Receita Federal do Brasil (RFB)
  </nome>
 </orgao>
 <situacao>
 </situacao>
</servico>