<?xml version="1.0" encoding="UTF-8"?>
<servico versao="2" xmlns="http://servicos.gov.br/cartas-servico/v2/schema/servico" xmlns:xsi="http://www.w3.org/2001/XMLSchema-instance" xsi:schemaLocation="http://servicos.gov.br/cartas-servico/v2/schema/servico ../servico.xsd">
 <nome>
  Cadastro de Procuração para o Portal e-CAC – Presencial
 </nome>
 <nomes-populares>
 </nomes-populares>
 <descricao>Cadastrar, consultar e cancelar procuração, que delega a terceiro, possuidor de certificado digital, a
        realização de serviços dentro do portal e-CAC. Não há necessidade de o outorgante possuir certificado digital
        para constituir a procuração. No caso do cadastro e cancelamento, o documento impresso deve ser entregue na
        unidade de atendimento presencial, conforme orientações gerais. Não há necessidade de o outorgante possuir
        certificado digital para constituir a procuração.


 </descricao>
 <palavras-chave>
 </palavras-chave>
 <areas-de-interesse>
  <area-de-interesse>
   <id>
    economia-e-financas
   </id>
   <area>Economia e Finanças</area>
  </area-de-interesse>
 </areas-de-interesse>
 <segmentos-da-sociedade>
  <segmento-da-sociedade>
   <id>
    cidadaos
   </id>
   <nome>
    Cidadãos
   </nome>
  </segmento-da-sociedade>
  <segmento-da-sociedade>
   <id>
    empresas
   </id>
   <nome>
    Empresas
   </nome>
  </segmento-da-sociedade>
 </segmentos-da-sociedade>
 <eventos-da-linha-da-vida></eventos-da-linha-da-vida>
 <legislacao-relacionada></legislacao-relacionada>
 <solicitantes></solicitantes>
 <etapas>
  <etapa>
   <titulo>
   </titulo>
   <descricao>
   </descricao>
   <documentos></documentos>
   <custos excecoes="false">
    <custo>
     <descricao>
     </descricao>
     <valor>
     </valor>
    </custo>
   </custos>
   <canais-de-prestacao>
    <canal-de-prestacao tipo="Web" preferencial="true">
     <titulo>
     </titulo>
     <referencia>
      http://www.receita.fazenda.gov.br/Aplicacoes/ATSDR/procuracoesrfb/controlador/controlePrincipal.asp?acao=telaInicial
     </referencia>
    </canal-de-prestacao>
    <canal-de-prestacao tipo="Agendamento" preferencial="false">
     <titulo>
     </titulo>
     <referencia>
     </referencia>
    </canal-de-prestacao>
   </canais-de-prestacao>
  </etapa>
 </etapas>
 <orgao>
  <id>
   secretaria-da-receita-federal-do-brasil-rfb
  </id>
  <nome>
   Secretaria da Receita Federal do Brasil (RFB)
  </nome>
 </orgao>
 <situacao>
 </situacao>
</servico>