<?xml version="1.0" encoding="UTF-8"?>
<servico versao="2" xmlns="http://servicos.gov.br/cartas-servico/v2/schema/servico" xmlns:xsi="http://www.w3.org/2001/XMLSchema-instance" xsi:schemaLocation="http://servicos.gov.br/cartas-servico/v2/schema/servico ../servico.xsd">
 <nome>
  Consulta - Obras do Ministério do Turismo em seu Município
 </nome>
 <nomes-populares>
 </nomes-populares>
 <descricao>Consulta ao andamento dos contratos de repasse referente a obras de infraestrutura turística nos municípios.

* Mais informações sobre o andamento de cada obra podem ser obtidas via Sistema de Informações ao Cidadão (SIC): sic@turismo.gov.br, ou (61) 2023-7146
 </descricao>
 <palavras-chave>
 </palavras-chave>
 <areas-de-interesse>
  <area-de-interesse>
   <id>
    comercio-e-servicos
   </id>
   <area>Comércio e Serviços</area>
  </area-de-interesse>
  <area-de-interesse>
   <id>
    turismo
   </id>
   <area>Turismo</area>
  </area-de-interesse>
 </areas-de-interesse>
 <segmentos-da-sociedade>
  <segmento-da-sociedade>
   <id>
    cidadaos
   </id>
   <nome>
    Cidadãos
   </nome>
  </segmento-da-sociedade>
 </segmentos-da-sociedade>
 <eventos-da-linha-da-vida></eventos-da-linha-da-vida>
 <legislacao-relacionada></legislacao-relacionada>
 <solicitantes></solicitantes>
 <etapas>
  <etapa>
   <titulo>
   </titulo>
   <descricao>
   </descricao>
   <documentos></documentos>
   <custos excecoes="false">
    <custo>
     <descricao>
     </descricao>
     <valor>
     </valor>
    </custo>
   </custos>
   <canais-de-prestacao>
    <canal-de-prestacao tipo="Web" preferencial="true">
     <titulo>
     </titulo>
     <referencia>
      http://repasse.turismo.gov.br/
     </referencia>
    </canal-de-prestacao>
    <canal-de-prestacao tipo="Agendamento" preferencial="false">
     <titulo>
     </titulo>
     <referencia>
     </referencia>
    </canal-de-prestacao>
   </canais-de-prestacao>
  </etapa>
 </etapas>
 <orgao>
  <id>
   ministerio-do-turismo-mtur
  </id>
  <nome>
   Ministério do Turismo (MTur)
  </nome>
 </orgao>
 <situacao>
 </situacao>
</servico>