<?xml version="1.0" encoding="UTF-8"?>
<servico versao="2" xmlns="http://servicos.gov.br/cartas-servico/v2/schema/servico" xmlns:xsi="http://www.w3.org/2001/XMLSchema-instance" xsi:schemaLocation="http://servicos.gov.br/cartas-servico/v2/schema/servico ../servico.xsd">
 <nome>
  Aposentadoria por Idade
 </nome>
 <nomes-populares>
 </nomes-populares>
 <descricao>Benefício devido aos trabalhadores urbanos do sexo masculino a partir dos 65 anos e do sexo feminino a partir dos 60 anos de idade. Os trabalhadores rurais podem pedir aposentadoria por idade com cinco anos a menos: a partir dos 60 anos, homens, e a partir dos 55 anos, mulheres.


 </descricao>
 <palavras-chave>
 </palavras-chave>
 <areas-de-interesse>
  <area-de-interesse>
   <id>
    previdencia-social
   </id>
   <area>Previdência Social</area>
  </area-de-interesse>
 </areas-de-interesse>
 <segmentos-da-sociedade>
  <segmento-da-sociedade>
   <id>
    cidadaos
   </id>
   <nome>
    Cidadãos
   </nome>
  </segmento-da-sociedade>
 </segmentos-da-sociedade>
 <eventos-da-linha-da-vida>
  <evento-da-linha-da-vida>
   <id>
    aposentadoria
   </id>
   <nome>
    Aposentadoria
   </nome>
  </evento-da-linha-da-vida>
 </eventos-da-linha-da-vida>
 <legislacao-relacionada></legislacao-relacionada>
 <solicitantes></solicitantes>
 <etapas>
  <etapa>
   <titulo>
   </titulo>
   <descricao>
   </descricao>
   <documentos></documentos>
   <custos excecoes="false">
    <custo>
     <descricao>
     </descricao>
     <valor>
     </valor>
    </custo>
   </custos>
   <canais-de-prestacao>
    <canal-de-prestacao tipo="Web" preferencial="true">
     <titulo>
     </titulo>
     <referencia>
     </referencia>
    </canal-de-prestacao>
    <canal-de-prestacao tipo="Agendamento" preferencial="false">
     <titulo>
     </titulo>
     <referencia>
      http://www2.dataprev.gov.br/prevagenda/OpcaoInicialTela.view
     </referencia>
    </canal-de-prestacao>
    <canal-de-prestacao tipo="Presencial" preferencial="false">
     <titulo>
     </titulo>
     <referencia>
     </referencia>
    </canal-de-prestacao>
   </canais-de-prestacao>
  </etapa>
 </etapas>
 <orgao>
  <id>
   ministerio-da-previdencia-social-mps
  </id>
  <nome>
   Ministério da Previdência Social (MPS)
  </nome>
 </orgao>
 <situacao>
 </situacao>
</servico>