<?xml version="1.0" encoding="UTF-8"?>
<servico versao="2" xmlns="http://servicos.gov.br/cartas-servico/v2/schema/servico" xmlns:xsi="http://www.w3.org/2001/XMLSchema-instance" xsi:schemaLocation="http://servicos.gov.br/cartas-servico/v2/schema/servico ../servico.xsd">
 <nome>
  Portal do Professor
 </nome>
 <nomes-populares>
 </nomes-populares>
 <descricao>O Portal do Professor, acessível on-line desde 2008, em parceria com o Ministério da Ciência, Tecnologia e Inovação, apoia os processos de formação dos professores brasileiros e ajuda a enriquecer a prática pedagógica. No portal, os profissionais da educação podem produzir e compartilhar sugestões de aulas; buscar informações diversas sobre a prática educacional; baixar coleções de recursos multimídia; obter informações sobre cursos e material de estudos; interagir e colaborar com outros professores.


 </descricao>
 <palavras-chave>
 </palavras-chave>
 <areas-de-interesse>
  <area-de-interesse>
   <id>
    educacao
   </id>
   <area>Educação</area>
  </area-de-interesse>
 </areas-de-interesse>
 <segmentos-da-sociedade></segmentos-da-sociedade>
 <eventos-da-linha-da-vida>
  <evento-da-linha-da-vida>
   <id>
    profissao-e-trabalho
   </id>
   <nome>
    Profissão e trabalho
   </nome>
  </evento-da-linha-da-vida>
 </eventos-da-linha-da-vida>
 <legislacao-relacionada></legislacao-relacionada>
 <solicitantes></solicitantes>
 <etapas>
  <etapa>
   <titulo>
   </titulo>
   <descricao>
   </descricao>
   <documentos></documentos>
   <custos excecoes="false">
    <custo>
     <descricao>
     </descricao>
     <valor>
     </valor>
    </custo>
   </custos>
   <canais-de-prestacao>
    <canal-de-prestacao tipo="Web" preferencial="true">
     <titulo>
     </titulo>
     <referencia>
      http://portaldoprofessor.mec.gov.br/sobre.html
     </referencia>
    </canal-de-prestacao>
    <canal-de-prestacao tipo="Agendamento" preferencial="false">
     <titulo>
     </titulo>
     <referencia>
     </referencia>
    </canal-de-prestacao>
   </canais-de-prestacao>
  </etapa>
 </etapas>
 <orgao>
  <id>
   ministerio-da-educacao-mec
  </id>
  <nome>
   Ministério da Educação (MEC)
  </nome>
 </orgao>
 <situacao>
 </situacao>
</servico>