<?xml version="1.0" encoding="UTF-8"?>
<servico versao="2" xmlns="http://servicos.gov.br/cartas-servico/v2/schema/servico" xmlns:xsi="http://www.w3.org/2001/XMLSchema-instance" xsi:schemaLocation="http://servicos.gov.br/cartas-servico/v2/schema/servico ../servico.xsd">
 <nome>
  Requerimento para Prioridade no Pagamento de Restituição de Imposto de Renda
 </nome>
 <nomes-populares>
 </nomes-populares>
 <descricao>Requerer prioridade no pagamento de restituição do imposto de renda da pessoa física (art. 69-A da Lei nº 9.784/99).


 </descricao>
 <palavras-chave>
 </palavras-chave>
 <areas-de-interesse>
  <area-de-interesse>
   <id>
    economia-e-financas
   </id>
   <area>Economia e Finanças</area>
  </area-de-interesse>
 </areas-de-interesse>
 <segmentos-da-sociedade>
  <segmento-da-sociedade>
   <id>
    cidadaos
   </id>
   <nome>
    Cidadãos
   </nome>
  </segmento-da-sociedade>
 </segmentos-da-sociedade>
 <eventos-da-linha-da-vida>
  <evento-da-linha-da-vida>
   <id>
    contas-e-impostos
   </id>
   <nome>
    Contas e Impostos
   </nome>
  </evento-da-linha-da-vida>
 </eventos-da-linha-da-vida>
 <legislacao-relacionada></legislacao-relacionada>
 <solicitantes></solicitantes>
 <etapas>
  <etapa>
   <titulo>
   </titulo>
   <descricao>
   </descricao>
   <documentos></documentos>
   <custos excecoes="false">
    <custo>
     <descricao>
     </descricao>
     <valor>
     </valor>
    </custo>
   </custos>
   <canais-de-prestacao>
    <canal-de-prestacao tipo="Web" preferencial="true">
     <titulo>
     </titulo>
     <referencia>
      https://www.google.com.br/url?sa=t&amp;rct=j&amp;q=&amp;esrc=s&amp;source=web&amp;cd=1&amp;cad=rja&amp;uact=8&amp;ved=0CB4QFjAA&amp;url=http%3A%2F%2Fwww.receita.fazenda.gov.br%2Fpublico%2Fformularios%2FRequerimento_Prioridade_Pgto_Restituicao_PF.doc&amp;ei=S_VQVajiLcHAggSJhIDACQ&amp;usg=AFQjCNEbEB7b5AHTaZzFKZAVT4Yi-SM_Lg&amp;sig2=YaZqZY9-8ctC34eMF709_Q
     </referencia>
    </canal-de-prestacao>
    <canal-de-prestacao tipo="Agendamento" preferencial="false">
     <titulo>
     </titulo>
     <referencia>
     </referencia>
    </canal-de-prestacao>
   </canais-de-prestacao>
  </etapa>
 </etapas>
 <orgao>
  <id>
   secretaria-da-receita-federal-do-brasil-rfb
  </id>
  <nome>
   Secretaria da Receita Federal do Brasil (RFB)
  </nome>
 </orgao>
 <situacao>
 </situacao>
</servico>