<?xml version="1.0" encoding="UTF-8"?>
<servico versao="2" xmlns="http://servicos.gov.br/cartas-servico/v2/schema/servico" xmlns:xsi="http://www.w3.org/2001/XMLSchema-instance" xsi:schemaLocation="http://servicos.gov.br/cartas-servico/v2/schema/servico ../servico.xsd">
 <nome>
  Programa Bolsa Família - PBF
 </nome>
 <nomes-populares>
 </nomes-populares>
 <descricao>O Bolsa Família é um programa que transfere renda diretamente para as famílias pobres como forma de garantir o direito à alimentação adequada, à educação e à saúde. As famílias extremamente pobres recebem um valor necessário para que cada membro da família ganhe no mínimo R$ 70,00. Ou seja, somado o valor do Bolsa Família e a renda desta família fica garantida uma renda por pessoa superior a R$ 70,00.

Para as famílias pobres que recebem entre R$ 70,01 e R$ 140,00 o Bolsa Família repassa uma bolsa para cada criança, jovem, gestante ou nutriz. Para continuar a receber o benefício do Bolsa, a família deve manter as crianças e adolescentes na escola, assim como manter em dia o calendário de vacinação dos filhos de até 7 (sete) anos. As mulheres grávidas precisam fazer as consultas do pré-natal e as mães que estão amamentando (nutrizes) devem continuar o acompanhamento da sua saúde e da saúde do bebê.

Para receber o Bolsa Família tem que se inscrever no Cadastro Único e quem recebe tem que atualizar suas informações no Cadastro Único a cada dois anos ou sempre que houver alguma mudança na situação da família. O Bolsa Família é repassado através de cartão magnético preferencialmente para as mães.

* [Neste site você pode localizar o CRAS mais perto de sua residência. Esses dados podem ser localizados no mapa, basta escolher o seu Estado e o seu Município.](http://aplicacoes.mds.gov.br/sagi/FerramentasSAGI/Mops/)
 </descricao>
 <palavras-chave>
 </palavras-chave>
 <areas-de-interesse>
  <area-de-interesse>
   <id>
    previdencia-social
   </id>
   <area>Previdência Social</area>
  </area-de-interesse>
 </areas-de-interesse>
 <segmentos-da-sociedade>
  <segmento-da-sociedade>
   <id>
    cidadaos
   </id>
   <nome>
    Cidadãos
   </nome>
  </segmento-da-sociedade>
 </segmentos-da-sociedade>
 <eventos-da-linha-da-vida>
  <evento-da-linha-da-vida>
   <id>
    familia
   </id>
   <nome>
    Família
   </nome>
  </evento-da-linha-da-vida>
  <evento-da-linha-da-vida>
   <id>
    apoio-financeiro-e-credito
   </id>
   <nome>
    Apoio financeiro e crédito
   </nome>
  </evento-da-linha-da-vida>
 </eventos-da-linha-da-vida>
 <legislacao-relacionada></legislacao-relacionada>
 <solicitantes></solicitantes>
 <etapas>
  <etapa>
   <titulo>
   </titulo>
   <descricao>
   </descricao>
   <documentos></documentos>
   <custos excecoes="false">
    <custo>
     <descricao>
     </descricao>
     <valor>
     </valor>
    </custo>
   </custos>
   <canais-de-prestacao>
    <canal-de-prestacao tipo="Web" preferencial="true">
     <titulo>
     </titulo>
     <referencia>
     </referencia>
    </canal-de-prestacao>
    <canal-de-prestacao tipo="Agendamento" preferencial="false">
     <titulo>
     </titulo>
     <referencia>
     </referencia>
    </canal-de-prestacao>
    <canal-de-prestacao tipo="Presencial" preferencial="false">
     <titulo>
     </titulo>
     <referencia>
     </referencia>
    </canal-de-prestacao>
   </canais-de-prestacao>
  </etapa>
 </etapas>
 <orgao>
  <id>
   ministerio-do-desenvolvimento-social-e-combate-a-fome-mds
  </id>
  <nome>
   Ministério do Desenvolvimento Social e Combate à Fome (MDS)
  </nome>
 </orgao>
 <situacao>
 </situacao>
</servico>