<?xml version="1.0" encoding="UTF-8"?>
<servico versao="2" xmlns="http://servicos.gov.br/cartas-servico/v2/schema/servico" xmlns:xsi="http://www.w3.org/2001/XMLSchema-instance" xsi:schemaLocation="http://servicos.gov.br/cartas-servico/v2/schema/servico ../servico.xsd">
 <nome>
  Declaração de Capitais Brasileiros no Exterior
 </nome>
 <nomes-populares>
 </nomes-populares>
 <descricao>Página em que o cidadão pode declarar os bens e valores que possuir no exterior.

Devem declarar, todo ano, todos os residentes no País detentores de bens e valores fora do território nacional, que totalizem montante igual ou superior ao equivalente US$100.000,00 (cem mil dólares dos Estados Unidos).

Para aqueles que possuem bens de valor total igual ou superior a US$100.000.000,00 (cem milhões de dólares dos Estados Unidos), a declaração deve ser feita trimestralmente.


 </descricao>
 <palavras-chave>
 </palavras-chave>
 <areas-de-interesse>
  <area-de-interesse>
   <id>
    economia-e-financas
   </id>
   <area>Economia e Finanças</area>
  </area-de-interesse>
 </areas-de-interesse>
 <segmentos-da-sociedade></segmentos-da-sociedade>
 <eventos-da-linha-da-vida>
  <evento-da-linha-da-vida>
   <id>
    viagem-ao-exterior
   </id>
   <nome>
    Viagem ao exterior
   </nome>
  </evento-da-linha-da-vida>
 </eventos-da-linha-da-vida>
 <legislacao-relacionada></legislacao-relacionada>
 <solicitantes></solicitantes>
 <etapas>
  <etapa>
   <titulo>
   </titulo>
   <descricao>
   </descricao>
   <documentos></documentos>
   <custos excecoes="false">
    <custo>
     <descricao>
     </descricao>
     <valor>
     </valor>
    </custo>
   </custos>
   <canais-de-prestacao>
    <canal-de-prestacao tipo="Web" preferencial="true">
     <titulo>
     </titulo>
     <referencia>
      http://www4.bcb.gov.br/rex/CBE/Port/cbe.asp
     </referencia>
    </canal-de-prestacao>
    <canal-de-prestacao tipo="Agendamento" preferencial="false">
     <titulo>
     </titulo>
     <referencia>
     </referencia>
    </canal-de-prestacao>
   </canais-de-prestacao>
  </etapa>
 </etapas>
 <orgao>
  <id>
   banco-central-do-brasil-bcb
  </id>
  <nome>
   Banco Central do Brasil (BCB)
  </nome>
 </orgao>
 <situacao>
 </situacao>
</servico>