<?xml version="1.0" encoding="UTF-8"?>
<servico versao="2" xmlns="http://servicos.gov.br/cartas-servico/v2/schema/servico" xmlns:xsi="http://www.w3.org/2001/XMLSchema-instance" xsi:schemaLocation="http://servicos.gov.br/cartas-servico/v2/schema/servico ../servico.xsd">
 <nome>
  Consulta Participação no Acompanhamento Diferenciado
 </nome>
 <nomes-populares>
 </nomes-populares>
 <descricao>Consultar histórico de participação no acompanhamento econômico-tributário diferenciado e especial. Esta consulta permite a todos os contribuintes pessoas jurídicas, diferenciadas ou não, realizarem consulta ao histórico de sua participação no acompanhamento econômico-tributário diferenciado de que trata a Portaria Receita Federal nº 2.356, de 14 de dezembro de 2010.


 </descricao>
 <palavras-chave>
 </palavras-chave>
 <areas-de-interesse>
  <area-de-interesse>
   <id>
    economia-e-financas
   </id>
   <area>Economia e Finanças</area>
  </area-de-interesse>
 </areas-de-interesse>
 <segmentos-da-sociedade>
  <segmento-da-sociedade>
   <id>
    empresas
   </id>
   <nome>
    Empresas
   </nome>
  </segmento-da-sociedade>
 </segmentos-da-sociedade>
 <eventos-da-linha-da-vida>
  <evento-da-linha-da-vida>
   <id>
    contas-e-impostos
   </id>
   <nome>
    Contas e Impostos
   </nome>
  </evento-da-linha-da-vida>
 </eventos-da-linha-da-vida>
 <legislacao-relacionada></legislacao-relacionada>
 <solicitantes></solicitantes>
 <etapas>
  <etapa>
   <titulo>
   </titulo>
   <descricao>
   </descricao>
   <documentos></documentos>
   <custos excecoes="false">
    <custo>
     <descricao>
     </descricao>
     <valor>
     </valor>
    </custo>
   </custos>
   <canais-de-prestacao>
    <canal-de-prestacao tipo="Web" preferencial="true">
     <titulo>
     </titulo>
     <referencia>
      https://cav.receita.fazenda.gov.br/eCAC/publico/login.aspx?sistema=00074
     </referencia>
    </canal-de-prestacao>
    <canal-de-prestacao tipo="Agendamento" preferencial="false">
     <titulo>
     </titulo>
     <referencia>
     </referencia>
    </canal-de-prestacao>
   </canais-de-prestacao>
  </etapa>
 </etapas>
 <orgao>
  <id>
   secretaria-da-receita-federal-do-brasil-rfb
  </id>
  <nome>
   Secretaria da Receita Federal do Brasil (RFB)
  </nome>
 </orgao>
 <situacao>
 </situacao>
</servico>