<?xml version="1.0" encoding="UTF-8"?>
<servico versao="2" xmlns="http://servicos.gov.br/cartas-servico/v2/schema/servico" xmlns:xsi="http://www.w3.org/2001/XMLSchema-instance" xsi:schemaLocation="http://servicos.gov.br/cartas-servico/v2/schema/servico ../servico.xsd">
 <nome>
  Consulta à Situação dos Voos
 </nome>
 <nomes-populares>
 </nomes-populares>
 <descricao>O Infraero Voos Online é uma ferramenta que consolida informações dos principais aeroportos brasileiros a respeito da situação atual de seu voo. Ela possibilita o rastreio de status dos voos em tempo quase real.

Além de consultar os horários de partidas e chegadas de voos, você também pode saber qual a distância de onde você está até o aeroporto para onde precisa ir e a previsão do tempo na cidade onde fica o aeroporto.

Consulte, antes de sair de casa, para descobrir se seu voo está no horário. Acesse a partir do website dedicado ou por meio de aplicativos mobile (Android e Iphone/Ipad).

* [Aplicativo mobile para a plataforma Android](https://play.google.com/store/apps/details?id=br.gov.infraero&amp;hl=pt_BR)
* [Aplicativo mobile para a plataforma Apple](https://itunes.apple.com/br/app/infraero-voos-online/id412206183?mt=8)
* [Consulte, também, a informação atualizada do número de atrasos e cancelamentos nos aeroportos operados pela Infraero.](http://www.infraero.gov.br/index.php/br/situacao-dos-voos/por-aeroporto.html)
 </descricao>
 <palavras-chave>
 </palavras-chave>
 <areas-de-interesse>
  <area-de-interesse>
   <id>
    trabalho
   </id>
   <area>Trabalho</area>
  </area-de-interesse>
 </areas-de-interesse>
 <segmentos-da-sociedade>
  <segmento-da-sociedade>
   <id>
    cidadaos
   </id>
   <nome>
    Cidadãos
   </nome>
  </segmento-da-sociedade>
 </segmentos-da-sociedade>
 <eventos-da-linha-da-vida>
  <evento-da-linha-da-vida>
   <id>
    viagem-ao-exterior
   </id>
   <nome>
    Viagem ao exterior
   </nome>
  </evento-da-linha-da-vida>
 </eventos-da-linha-da-vida>
 <legislacao-relacionada></legislacao-relacionada>
 <solicitantes></solicitantes>
 <etapas>
  <etapa>
   <titulo>
   </titulo>
   <descricao>
   </descricao>
   <documentos></documentos>
   <custos excecoes="false">
    <custo>
     <descricao>
     </descricao>
     <valor>
     </valor>
    </custo>
   </custos>
   <canais-de-prestacao>
    <canal-de-prestacao tipo="Web" preferencial="true">
     <titulo>
     </titulo>
     <referencia>
      http://voos.infraero.gov.br/voos/index.aspx
     </referencia>
    </canal-de-prestacao>
    <canal-de-prestacao tipo="Agendamento" preferencial="false">
     <titulo>
     </titulo>
     <referencia>
     </referencia>
    </canal-de-prestacao>
    <canal-de-prestacao tipo="Aplicativo móvel" preferencial="false">
     <titulo>
     </titulo>
     <referencia>
     </referencia>
    </canal-de-prestacao>
   </canais-de-prestacao>
  </etapa>
 </etapas>
 <orgao>
  <id>
   secretaria-de-aviacao-civil-sac
  </id>
  <nome>
   Secretaria de Aviação Civil (SAC)
  </nome>
 </orgao>
 <situacao>
 </situacao>
</servico>