<?xml version="1.0" encoding="UTF-8"?>
<servico versao="2" xmlns="http://servicos.gov.br/cartas-servico/v2/schema/servico" xmlns:xsi="http://www.w3.org/2001/XMLSchema-instance" xsi:schemaLocation="http://servicos.gov.br/cartas-servico/v2/schema/servico ../servico.xsd">
 <nome>
  Seguro-Desemprego
 </nome>
 <nomes-populares>
 </nomes-populares>
 <descricao>Seguro-Desemprego Formal: Seguro-desemprego ao trabalhador formal possui como finalidade: prover assistência financeira temporária a trabalhadores desempregados sem justa causa e auxiliá-los na busca de um novo emprego, por meio de orientação, recolocação no mercado de trabalho e/ou qualificação profissional.

Seguro-Desemprego Pescador Artesanal: É dirigido ao pescador profissional que exerça sua atividade de forma artesanal, individual ou em regime de economia familiar, ainda que com auxílio eventual de parceiros e que teve que interromper a atividade pesqueira devido ao período de proibição da pesca, para preservação da espécie (defeso), fixado através de Instrumento Normativo publicado no Diário Oficial da União.

Seguro-Desemprego Empregado Doméstico: Trata-se de ação que resulta em pagamento do benefício instituído pela Lei n.º 10.208, de 23 de março de 2001, tem por finalidade prover assistência financeira temporária ao empregado doméstico dispensado sem justa causa. O valor de cada parcela é de um salário mínimo, sendo que cada segurado recebe no máximo três parcelas. Com a aprovação da Emenda Constitucional nº 72, de 2 de abril de 2013, houve equiparação de direitos trabalhistas entre o doméstico e demais trabalhadores, entretanto, necessita-se de regulamentação quanto a percepção igualitária de parcelas inerentes ao seguro-desemprego.

Seguro-Desemprego Trabalhador Resgatado: É um auxílio temporário concedido ao trabalhador comprovadamente resgatado de regime de trabalho forçado ou da condição análoga à de escravo. Tendo direito a no máximo três parcelas no valor de um salário mínimo.

Seguro-Desemprego Bolsa Qualificação: A Bolsa de Qualificação Profissional é um benefício destinado a subvencionar os trabalhadores com contrato de trabalho suspenso, em conformidade com o disposto em convenção ou acordo coletivo de trabalho, devidamente matriculado em curso ou programa de qualificação profissional oferecido pelo empregador.

* [Consulta: Habilitação do Seguro-Desemprego](http://granulito.mte.gov.br/sdweb/consulta.jsf)
* [Modalidade de Seguro-Desemprego Empregado Doméstico](http://portal.mte.gov.br/seg_desemp/seguro-desemprego-trabalhador-domestico.htm)
* [Modalidade de Seguro-Desemprego Pescador Artesanal](http://portal.mte.gov.br/seg_desemp/seguro-desemprego-pescador-artesanal.htm)
* [Modalidade Seguro-Desemprego Trabalhador Resgatado](http://portal.mte.gov.br/seg_desemp/modalidades-seguro-desemprego-empregado-resgatado.htm)
* [Modalidade de Seguro-Desemprego Formal](http://portal.mte.gov.br/seg_desemp/seguro-desemprego-formal-2.htm)
* [Bolsa Qualificação](http://portal.mte.gov.br/seg_desemp/bolsa-qualificacao.htm)
* Coordenação-Geral do Seguro-Desemprego: (61) 2031-6679 Pescador Artesanal: (61) 2031-6043/6973 Empregado Doméstico/Trabalhador Resgatado: (61) 2031-6135/6226 Bolsa Qualificação: (61) 2031-6196/6509
* [Postos de atendimento do Ministério do Trabalho e Emprego](http://portal.mte.gov.br/postos/)
 </descricao>
 <palavras-chave>
 </palavras-chave>
 <areas-de-interesse>
  <area-de-interesse>
   <id>
    trabalho
   </id>
   <area>Trabalho</area>
  </area-de-interesse>
 </areas-de-interesse>
 <segmentos-da-sociedade>
  <segmento-da-sociedade>
   <id>
    cidadaos
   </id>
   <nome>
    Cidadãos
   </nome>
  </segmento-da-sociedade>
 </segmentos-da-sociedade>
 <eventos-da-linha-da-vida>
  <evento-da-linha-da-vida>
   <id>
    apoio-financeiro-e-credito
   </id>
   <nome>
    Apoio financeiro e crédito
   </nome>
  </evento-da-linha-da-vida>
  <evento-da-linha-da-vida>
   <id>
    profissao-e-trabalho
   </id>
   <nome>
    Profissão e trabalho
   </nome>
  </evento-da-linha-da-vida>
 </eventos-da-linha-da-vida>
 <legislacao-relacionada></legislacao-relacionada>
 <solicitantes></solicitantes>
 <etapas>
  <etapa>
   <titulo>
   </titulo>
   <descricao>
   </descricao>
   <documentos></documentos>
   <custos excecoes="false">
    <custo>
     <descricao>
     </descricao>
     <valor>
     </valor>
    </custo>
   </custos>
   <canais-de-prestacao>
    <canal-de-prestacao tipo="Web" preferencial="true">
     <titulo>
     </titulo>
     <referencia>
     </referencia>
    </canal-de-prestacao>
    <canal-de-prestacao tipo="Agendamento" preferencial="false">
     <titulo>
     </titulo>
     <referencia>
     </referencia>
    </canal-de-prestacao>
    <canal-de-prestacao tipo="Presencial" preferencial="false">
     <titulo>
     </titulo>
     <referencia>
     </referencia>
    </canal-de-prestacao>
   </canais-de-prestacao>
  </etapa>
 </etapas>
 <orgao>
  <id>
   ministerio-do-trabalho-e-emprego-mte
  </id>
  <nome>
   Ministério do Trabalho e Emprego (MTE)
  </nome>
 </orgao>
 <situacao>
 </situacao>
</servico>