<?xml version="1.0" encoding="UTF-8"?>
<servico versao="2" xmlns="http://servicos.gov.br/cartas-servico/v2/schema/servico" xmlns:xsi="http://www.w3.org/2001/XMLSchema-instance" xsi:schemaLocation="http://servicos.gov.br/cartas-servico/v2/schema/servico ../servico.xsd">
 <nome>
  Acesso aos Acervos da Fundação Nacional do Índio - FUNAI
 </nome>
 <nomes-populares>
 </nomes-populares>
 <descricao>A Fundação Nacional do Índio - FUNAI - tem como missão coordenar o processo de formulação e implementação da política indigenista do Estado brasileiro, instituindo mecanismos efetivos de controle social e de gestão participativa, visando à proteção e promoção dos direitos dos povos indígenas.

Os atendimentos oferecidos aos cidadãos pela FUNAI relativos ao acesso aos seus acervos são:

- Acesso aos acervos arquivísticos (documentais) do fundo Serviço de Proteção ao Índio - SPI e aos acervos do período Funai, via Serviço de Gestão Documental – Brasília, e Serviço de Referências Documentais do Museu do Índio – Rio de Janeiro;

- Acesso aos acervos bibliográficos sobre a temática indígena, ambiental e indigenista, no Serviço de Gestão de Bibliotecas – Brasília, e Biblioteca do Museu do Índio – Rio de Janeiro e;

- Acesso aos acervos etnográficos e audiovisuais – Serviço de Referências Documentais do Museu do Índio – Rio de Janeiro.

* [Lei nº 12.527/11](http://www.planalto.gov.br/ccivil_03/_Ato2011-2014/2011/Lei/L12527.htm)
* Para Acervos Arquivísticos (documentais): sedoc@funai.gov.br (Serviço de Gestão Documental) ou referencia.documental@museudoindio.gov.br (Museu do Índio)
* Para Acervos Bibliograficos: sebib@funai.gov.br
* Para Acervos Etnográficos e Audiovisuais : referencia.documental@museudoindio.gov.br
* Para Acesso aos Acervos Etnográficos e Audiovisuais: (21)3214-8736.
 </descricao>
 <palavras-chave>
 </palavras-chave>
 <areas-de-interesse>
  <area-de-interesse>
   <id>
    protecao-social
   </id>
   <area>Proteção social</area>
  </area-de-interesse>
 </areas-de-interesse>
 <segmentos-da-sociedade></segmentos-da-sociedade>
 <eventos-da-linha-da-vida>
  <evento-da-linha-da-vida>
   <id>
    estudos
   </id>
   <nome>
    Estudos
   </nome>
  </evento-da-linha-da-vida>
 </eventos-da-linha-da-vida>
 <legislacao-relacionada></legislacao-relacionada>
 <solicitantes></solicitantes>
 <etapas>
  <etapa>
   <titulo>
   </titulo>
   <descricao>
   </descricao>
   <documentos></documentos>
   <custos excecoes="false">
    <custo>
     <descricao>
     </descricao>
     <valor>
     </valor>
    </custo>
   </custos>
   <canais-de-prestacao>
    <canal-de-prestacao tipo="Web" preferencial="true">
     <titulo>
     </titulo>
     <referencia>
      http://base2.museudoindio.gov.br
     </referencia>
    </canal-de-prestacao>
    <canal-de-prestacao tipo="Agendamento" preferencial="false">
     <titulo>
     </titulo>
     <referencia>
     </referencia>
    </canal-de-prestacao>
    <canal-de-prestacao tipo="Presencial" preferencial="false">
     <titulo>
     </titulo>
     <referencia>
     </referencia>
    </canal-de-prestacao>
    <canal-de-prestacao tipo="Presencial" preferencial="false">
     <titulo>
     </titulo>
     <referencia>
     </referencia>
    </canal-de-prestacao>
    <canal-de-prestacao tipo="Presencial" preferencial="false">
     <titulo>
     </titulo>
     <referencia>
     </referencia>
    </canal-de-prestacao>
    <canal-de-prestacao tipo="Presencial" preferencial="false">
     <titulo>
     </titulo>
     <referencia>
     </referencia>
    </canal-de-prestacao>
    <canal-de-prestacao tipo="Presencial" preferencial="false">
     <titulo>
     </titulo>
     <referencia>
     </referencia>
    </canal-de-prestacao>
   </canais-de-prestacao>
  </etapa>
 </etapas>
 <orgao>
  <id>
   ministerio-da-justica-mj
  </id>
  <nome>
   Ministério da Justiça (MJ)
  </nome>
 </orgao>
 <situacao>
 </situacao>
</servico>