<?xml version="1.0" encoding="UTF-8"?>
<servico versao="2" xmlns="http://servicos.gov.br/cartas-servico/v2/schema/servico" xmlns:xsi="http://www.w3.org/2001/XMLSchema-instance" xsi:schemaLocation="http://servicos.gov.br/cartas-servico/v2/schema/servico ../servico.xsd">
 <nome>
  Cadastramento de Senha para envio de Demonstrativos e Comprovante de Repasse Previdenciários
 </nome>
 <nomes-populares>
 </nomes-populares>
 <descricao>Tem como objetivo liberar senha para os representantes legais dos entes federativos, da Unidade Gestora e de seus servidores para o envio de demonstrativos e comprovante de repasse, visualização de CRP de todos os municípios de um estado e consultas relativas a aplicações e investimentos.

* Ligue 135 para obter mais informações.
 </descricao>
 <palavras-chave>
 </palavras-chave>
 <areas-de-interesse>
  <area-de-interesse>
   <id>
    previdencia-social
   </id>
   <area>Previdência Social</area>
  </area-de-interesse>
 </areas-de-interesse>
 <segmentos-da-sociedade>
  <segmento-da-sociedade>
   <id>
    empresas
   </id>
   <nome>
    Empresas
   </nome>
  </segmento-da-sociedade>
 </segmentos-da-sociedade>
 <eventos-da-linha-da-vida></eventos-da-linha-da-vida>
 <legislacao-relacionada></legislacao-relacionada>
 <solicitantes></solicitantes>
 <etapas>
  <etapa>
   <titulo>
   </titulo>
   <descricao>
   </descricao>
   <documentos></documentos>
   <custos excecoes="false">
    <custo>
     <descricao>
     </descricao>
     <valor>
     </valor>
    </custo>
   </custos>
   <canais-de-prestacao>
    <canal-de-prestacao tipo="Web" preferencial="true">
     <titulo>
     </titulo>
     <referencia>
      http://www1.previdencia.gov.br/sps/app/controleAcesso/cAcesso_login.asp?destino=CR
     </referencia>
    </canal-de-prestacao>
    <canal-de-prestacao tipo="Agendamento" preferencial="false">
     <titulo>
     </titulo>
     <referencia>
     </referencia>
    </canal-de-prestacao>
   </canais-de-prestacao>
  </etapa>
 </etapas>
 <orgao>
  <id>
   ministerio-da-previdencia-social-mps
  </id>
  <nome>
   Ministério da Previdência Social (MPS)
  </nome>
 </orgao>
 <situacao>
 </situacao>
</servico>